question_id,question
Q00677,are you looking for a specific job or the job search site
Q02444,do you want to see some closeup of a turbine
Q03131,would a video on the islands historical background be helpful
Q00027,are you asking about a specific theorist
Q01882,do you want the history of rock art
Q03871,would you like to see pictures to help you identify types of spider bites
Q02581,is the secret garden a book you are interested in
Q03375,would you like to know about david thompson
Q03242,would you like me to contact them for you
Q02093,do you want to know how to make ballet bars out of pvc
Q02158,do you want to know more about the 1957 novel
Q02135,do you want to know if there is an establishment that serves this
Q00598,are you looking for a class for elliptical trainer
Q01045,are you looking for tests to diagnose carpal tunnel syndrome
Q03850,would you like to see how to meet the legal requirement to be an equal opportunity employer
Q03123,will this be used as a animal pen
Q01454,are you wondering where churchill downs is
Q01174,are you looking to subsitute butter and margarine
Q02039,do you want to know how far the sun is away from different planets
Q03552,would you like to know more about the legality of golf gps systems
Q01115,are you looking for trombone dealers near yo
Q03201,would you like directions to flushing new york
Q02811,what is your favorite style of teddy bears custommade or mass production
Q03400,would you like to know about mister rogers family
Q00554,are you interested in where the bowflex power pro is produced
Q01592,do you need a tool to design the site
Q01887,do you want the lyrics on paper or on video
Q03021,which dinosaurs are you interested in
Q00028,are you asking about cannabis
Q01510,did you want to know when poem in your pocket day is
Q01131,are you looking for withdrawal rules for 403b plan
Q02366,do you want to know who won the last world series of poker
Q03309,would you like to buy a personalized teddy bear or a teddy bear for a specific occasion
Q01179,are you more interested in how art of war philosophy applies to your daily life
Q03844,would you like to see fun halloween science activities for middle school
Q00914,are you looking for instructions to build a fence
Q03019,which days history did you want to see
Q00188,are you interested in dreams interpretations dealing with water
Q03370,would you like to know about brazil political jurisdictions boundaries
Q03121,will this be a tall fence or short fence
Q00833,are you looking for flame design outline
Q01567,do you like using computers
Q02059,do you want to know how much dark chocolate you swould have for a day
Q03384,would you like to know about hair dye brands
Q00780,are you looking for chicken soup made from scratch by famouss chefs
Q02986,where in pocono are you interested in
Q03322,would you like to check the weather for traverse city
Q03429,would you like to know about the risks associated with barrets esophagus
Q02392,do you want to learn more about the usda food pyramid
Q01382,are you trying to login to the boards website
Q00449,are you interested in the history of the last supper painting
Q00786,are you looking for contact info in relation to bart sf
Q01764,do you want a list of all the volcano observatories in hawaii
Q02475,do you wish to know the location of native american houses
Q03733,would you like to learn about home remedies for treating a tooth abscess
Q02131,do you want to know if some people are allergic to cannellini beans
Q02737,what brand of keyboards are you looking for
Q03918,would you like to talk to a doctor about bhp treatment
Q01147,are you looking to buy pvc pipe
Q00927,are you looking for large battles
Q01410,are you wanting to know benefits of running vs walking
Q03468,would you like to know how south carolina was affected by the battles fought on its ground
Q03888,would you like to see some reviews
Q02511,how did you file your previous year taxes
Q01332,are you taking the bart from san francisco international airport
Q02014,do you want to know about worms in dogs
Q02638,is uss carl vilson log available
Q03208,would you like diretions to arkadeliphia health club
Q00698,are you looking for a specific web site about dinosaurs
Q03262,would you like the address for elvis presleys home
Q01964,do you want to know about a management position
Q01532,do you have a specific state in mind to search for mushrooms
Q01310,are you searching for possible health effects of this product
Q00261,are you interested in knowing more about a computer worm
Q01668,do you need me to order you any available now
Q03813,would you like to see a list of nicolas cage movies
Q02531,how many ps 2 games are you looking to buy
Q00708,are you looking for a video tutorial
Q02145,do you want to know more about carotid cavernous fistula treatment
Q01585,do you need a map of hotels
Q00433,are you interested in the exercises for carpal tunnel
Q03311,would you like to buy parts online or in person
Q01130,are you looking for wilson antenna parts
Q00934,are you looking for locations that have the scooters
Q01779,do you want a paralegal internship
Q01353,are you trying to compare different fitness centers in arkadelphia ar
Q03788,would you like to read some of frank lloyd wrights writings
Q00454,are you interested in the history of theories of evolution
Q02876,what size motor does the ford edge with problems have
Q03346,would you like to find out the different types of payment options for the best long term care insurance
Q03861,would you like to see music stores in your area
Q01745,do you pay child support in indiana
Q01814,do you want information about dreams interpretations about teeth falling out
Q00946,are you looking for more info on air travel in general or a specific flight
Q02345,do you want to know which civil war battles took place in south carolina
Q02087,do you want to know how to get prescribed the most common schizophrenic drug
Q00896,are you looking for information on mitchell college in connecticut
Q03903,would you like to see the signs of a heart attack in women or in men
Q03664,would you like to know what plants are native to madagascar
Q01511,did you want to know where the hawaiian volcano observatories are located
Q02202,do you want to know the federal pay cap for 2018
Q03525,would you like to know more about free credit reports
Q03907,would you like to see their homepage
Q03799,would you like to search for a doctor for a carotid cavernous fistula treatment
Q02318,do you want to know where churchill downs is located
Q02201,do you want to know the events going on here
Q02498,have you been diagnosed with angular cheilitis
Q01674,do you need numbers to retailers of this product
Q01082,are you looking for the middle names of the early presidents
Q01649,do you need information on accessories for the hp mini 2140
Q01842,do you want me to tell you who is the patron saint of mental illness
Q00168,are you interested in cartography
Q01039,are you looking for stores to buy ps 2 games from
Q01518,do need to see any specific information about 403b eligibility
Q00920,are you looking for kitchen furniture
Q01591,do you need a taxi
Q02530,how many miles does the ford edge with problems have on it
Q02361,do you want to know who started the movement
Q03347,would you like to find pampered chef recipes
Q01009,are you looking for signs to expect
Q01823,do you want information on arizona wildlife
Q00290,are you interested in learning how to read your credit report
Q03676,would you like to know what they are known for exporting
Q02894,what time are you wanting to visit this clinic
Q02673,there is a movie bewitched is this the cast you seek
Q00796,are you looking for declaration of independence at the national archives
Q00456,are you interested in the histroy behind it
Q02351,do you want to know who directed rain man
Q00740,are you looking for any specific games to play there
Q01863,do you want reviews of the les miserables tv series
Q02534,how much aroma would you like your plant have
Q03182,would you like a map with services or sites of interest listed
Q00039,are you asking for the mental benefits of running or physical
Q00602,are you looking for a company
Q00746,are you looking for any specific information in relation to beach volleyball
Q00720,are you looking for activities that involve plants
Q03302,would you like to book a new york hotel
Q02225,do you want to know the middle name of the current president of the united states
Q02293,do you want to know what pink slime in ground beef is made of
Q00715,are you looking for a world atlas
Q01154,are you looking to find a djs website
Q00607,are you looking for a deadliest catch product
Q02391,do you want to learn more about the show titans
Q02315,do you want to know when the idaho state flower was named
Q03554,would you like to know more about the patron saint of mental illness
Q03477,would you like to know how to calculate mean in excel
Q00541,are you interested in what draws a moth to flame
Q02421,do you want to renew a drivers license
Q01750,do you think of the reason to have dark chocolate
Q01150,are you looking to compare price points for theater systems
Q01690,do you need the address of jax chemical company
Q01942,do you want to find out what the hawaiian volcano observatories have been monitoring
Q02863,what price range of cell phones are you interested in
Q03529,would you like to know more about hr block
Q00418,are you interested in the character of fred rogers or the person who portrayed him on tv
Q00048,are you curious about the employment opportunies at the tennesse highway patrol
Q02431,do you want to see a selfquiz to determine if you have a tooth abscess
Q02622,is there certain information you would like about roosevelt island
Q00777,are you looking for casinos near french lick resort
Q03622,would you like to know the rescue efforts for the uss cole
Q03623,would you like to know the responsibilities of the maryland department of natural resources
Q02774,what exactly do you wanto to know about the dangers of asbestos
Q01623,do you need directions to the indiana state fairgrounds
Q00795,are you looking for deals and offers related to french lick resort
Q00670,are you looking for a specific dinosaur
Q02713,what are you trying to do with the mushrooms
Q03913,would you like to see what damage can be caused by an f5 tornado
Q00837,are you looking for food in hoboken
Q02471,do you wish to do an entity search
Q03571,would you like to know specific products from the company bobcat
Q01143,are you looking to buy an iron for your clothes
Q02846,what location would you like to search for dogs in
Q03671,would you like to know what the kiwi fruit tastes like
Q00217,are you interested in grilling a specefic food
Q00212,are you interested in gaming keyboards
Q03055,which part of the body are you interested in
Q03214,would you like historical information about us capitol maps
Q03520,would you like to know more about arrivals or departures
Q02988,where is basis of uss carl vilson
Q03142,would you also like to delete your history
Q03403,would you like to know about old town scottsdale
Q00236,are you interested in how much a patrol officer makes per year
Q02130,do you want to know if pink slime used at school canteens
Q03726,would you like to know why dogs heat up
Q02307,do you want to know what to plant in a raised garden
Q01783,do you want a single large lateral or multiple smaller laterals
Q00058,are you going to purchase any specific tools
Q00951,are you looking for natural remedies for a sore throat
Q02029,do you want to know famous black people
Q01202,are you referring to a certain philosohper
Q00583,are you interesting in buying furniture
Q00069,are you inquiring about the animals hooves
Q03873,would you like to see quotes by sun tzu
Q03565,would you like to know of upcoming concert dates
Q01658,do you need information on the prognosis of lymphoma in dogs
Q02275,do you want to know what company sells the most cannellini beans
Q00137,are you interested in any specific city in florida
Q03901,would you like to see the most effective methods of gmat prep
Q00604,are you looking for a comparison graph of average charitable donations
Q03175,would you like a list of videos about the subject
Q03462,would you like to know how many joints the human body has
Q03223,would you like information about the association of volleyball professionals
Q03582,would you like to know the capacity of ritz carlton lake las vegas
Q00782,are you looking for companies in the wind power arena
Q03803,would you like to see a comparison of living in india versus living in the usa
Q03589,would you like to know the countries in which bobcats are found
Q00767,are you looking for best treatments for angular cheilitis
Q00948,are you looking for more information about mgb
Q01046,are you looking for the age of rick warren
Q03330,would you like to directions to kansas city
Q01200,are you referencing earthquake activity
Q01832,do you want information on the current us president
Q02513,how do you know if your internet service is inexpensive
Q01902,do you want to apply for a job here
Q01304,are you searching for dieting pills
Q01834,do you want information on the person who invented music
Q02458,do you want to understand the science of space travel
Q03715,would you like to know which activities are associated with the people diagnosed with the carpal tunnel syndrome
Q00562,are you interested in who george bush srs son is
Q01289,are you referring to the voyager 1 or voyager 2
Q00851,are you looking for halloween movie to watch with the middle school kids
Q03796,would you like to request an appointment
Q02155,do you want to know more about ron howards directing career
Q03234,would you like information on the worth of coins
Q00609,are you looking for a definition of diversity
Q01982,do you want to know about kennycaffey syndorme
Q00316,are you interested in meaning of dreams involving insects
Q01437,are you wondering if it is hard to quit smoking
Q01572,do you mean the book or the movie
Q03344,would you like to find out more about enrollment in the schools
Q02154,do you want to know more about recreational activities
Q03126,will you like to know the most popular dog
Q03116,why are you looking to add supplements to your diet
Q03180,would you like a map of every state capitol
Q00234,are you interested in how gps was orginally made
Q02354,do you want to know who is hiring here
Q00742,are you looking for any specific information about arkadelphia health club
Q01298,are you seaching for east ridge high school community education
Q03426,would you like to know about the most recent satellite sent into orbit
Q00999,are you looking for reviews related to the pampered chef
Q02319,do you want to know where dark chocolate is made
Q01941,do you want to find out how much a golf instructor charges
Q01798,do you want directions to a certain hayride in pennsylvania
Q00322,are you interested in more information on the best long term care insurance
Q01006,are you looking for sewing patterns
Q03241,would you like low rated reviews
Q02710,what are the symptoms of cavernous fistula
Q01227,are you referring to cannellini bean recipes
Q03165,would you like a list of new york hotels
Q01840,do you want interpretation of running down
Q03060,which poker tournament are you interested in knowing more about
Q02679,want to know the call signs
Q02981,when was raspberry pi created
Q02662,should i request an application to mitchell college
Q03481,would you like to know how to frame a hip roof
Q03668,would you like to know what the causes are
Q00484,are you interested in the quote from shakespeare or the quote used in another context
Q01977,do you want to know about festivals in the city
Q03866,would you like to see pictures of a sore throat
Q01342,are you tring to find movies and tv shows where ron howard was an actor
Q01516,did you want to see if there was an app to do it
Q00831,are you looking for famous people who have great memories
Q01013,are you looking for solar water fountain kits
Q00150,are you interested in barbados ecology
Q03441,would you like to know anything specific related to it life style
Q02506,how big do you want your dog
Q00691,are you looking for a specific store
Q03229,would you like information on filing income taxes
Q02547,how old is ralph owen brewseter
Q02316,do you want to know when the next semester starts at mitchell college
Q00878,are you looking for information about staying at fickle creek farm
Q02499,have you been to the poconos before
Q00527,are you interested in visiting
Q01606,do you need any specific information on obama inauguration
Q03273,would you like the history of south africa
Q00915,are you looking for iron metal products
Q02148,do you want to know more about gear of land surveyor
Q03545,would you like to know more about the cultural impact of teddy bears
Q00985,are you looking for recipes with figs
Q00992,are you looking for reviews of gmat prep classes
Q01221,are you referring to alien vs predator
Q02258,do you want to know the value of old coins
Q03712,would you like to know where you can get cpr certified
Q02461,do you want to watch a tournament online
Q01777,do you want a map with driving directions
Q02741,what can i tell you about wilsons disease
Q02861,what price range are you looking at for a hayride in pennsylvania
Q00678,are you looking for a specific kind of maps and images
Q01064,are you looking for the definition of angular cheilitis
Q00945,are you looking for mitchell colleges tuition rates
Q02670,there are some interesting articles on preventing forearm pain are you interested
Q03930,would you like us to show you where to buy figs and other fresh fruit locally
Q00835,are you looking for flame designs for a tattoo
Q02910,what type of car do you want parts for
Q03646,would you like to know what animals are native to madagascar
Q02007,do you want to know about the source of the video game
Q01889,do you want the lyrics to the whole song
Q00959,are you looking for only the 2008 results
Q01363,are you trying to find films that ron howard directed
Q01376,are you trying to find uses for cannellini beans
Q01379,are you trying to know the warranty period of hp mini 2140
Q01844,do you want more information about the benefits of an elliptical trainer
Q02979,when do you want to take a gmat prep class
Q03088,which type of land surveyor are you interested in
Q02230,do you want to know the news about the border wall
Q02648,may i provide you medical definition of premature ventricular contractions
Q00907,are you looking for information on the purpose of joints
Q01627,do you need directions to your local vet
Q01817,do you want information about fees for indexed annuities
Q00862,are you looking for homeopathic remedies for a sore throat
Q02419,do you want to recycle used car parts
Q01323,are you seeking locations of beauty supplies in your area to make such purchase
Q02191,do you want to know the cost of an appraisal
Q03102,who are your favorite chefs
Q02738,what breed of bobcat are you looking for more information about
Q03432,would you like to know about the television show mister rogers neighborhood
Q02524,how many bedrooms do you want
Q00206,are you interested in flowers of a certain region
Q00991,are you looking for reviews of djs
Q00473,are you interested in the music man
Q00544,are you interested in what george bush srs policies were
Q03364,would you like to know a location to find dog clean bags
Q01286,are you referring to the time magazine essay
Q00154,are you interested in black celebrities
Q02079,do you want to know how to become one
Q03168,would you like a list of quotes by mister rogers
Q03759,would you like to learn more about how african american music influenced other genres of music
Q00764,are you looking for before or after results of flooding in manville nj due to hurricane irene
Q03367,would you like to know about awards the uss cole has won
Q02709,what are the memory options available for raspberry pi
Q00035,are you asking about the movie doctor zhivago
Q02061,do you want to know how much dnr costs
Q00844,are you looking for gas grill instruction
Q01001,are you looking for rice university
Q01829,do you want information on jobs in arkansas
Q02677,want to hear about related mayo clinic research
Q01590,do you need a retailer near you
Q00257,are you interested in jobs available in maryland department of natural resources
Q00464,are you interested in the medical ethics of treating jehovahs witnesses
Q03410,would you like to know about south african food
Q02705,what amount of investment income are you using the capital gains tax rate for
Q00084,are you interested in a list of companies in which you can get credit reports
Q00214,are you interested in getting a quote for coverage
Q00362,are you interested in raffles hotels and resorts
Q00121,are you interested in a specific type of penguin
Q00762,are you looking for bart travel schedules
Q03653,would you like to know what effects blood pressure and cholesterol
Q02585,is there a certain state that you are interested in seeing battles for
Q02178,do you want to know the benefit of carpenterter bee
Q00034,are you asking about the evolution of plants or animals
Q03791,would you like to read some reviews of the ritz carlton lake las vegas
Q03546,would you like to know more about the declaration of independence
Q00209,are you interested in fred rogers
Q01241,are you referring to putter golf
Q03763,would you like to learn more about the declaration of independence
Q01859,do you want reviews of the hp mini 2140
Q00382,are you interested in seeing art that features the colors black and gold
Q02885,what specifically do you need to know about fidel castro
Q03630,would you like to know the symptoms of a tooth abscess
Q01449,are you wondering what probe visited uranus
Q01912,do you want to buy merchandise with the patron saint of mental illness on it
Q03472,would you like to know how the war ended
Q00685,are you looking for a specific part of missouri
Q01303,are you searching for an image for lipoma
Q02594,is there a specific material it needs to be made from wood cement tin
Q01576,do you need 403b calculator
Q02551,how would you like to cook your pork tenderloin
Q03117,why type of hobby arts and crafts or sports
Q01749,do you study road maps
Q00194,are you interested in example of thank you letters for interview
Q01968,do you want to know about a specific person
Q02586,is there a certain type of dj you are looking for
Q03613,would you like to know the location of the headquarters of the company bobcat
Q00136,are you interested in any specific activities at university of carolina
Q02365,do you want to know who was involved in the missions
Q02217,do you want to know the location of fickle creek farm
Q01979,do you want to know about grilling meat
Q00128,are you interested in aj raffles
Q01810,do you want his biography
Q00491,are you interested in the rules for equipment of golf
Q03197,would you like current events stories about the cherokee tribe
Q01260,are you referring to the greek god or the pc
Q00805,are you looking for directions to a disneyland hotel
Q03577,would you like to know the age should to start buying best long term care insurance
Q00867,are you looking for how to use mgb
Q03128,woud you like a list of items made from iron
Q00996,are you looking for reviews of the music man
Q02944,what would you like to know about electronic skeet shoot
Q03629,would you like to know the symptoms of a dog in heat
Q01767,do you want a list of firms that are currently hiring paralegals
Q03479,would you like to know how to catch moths
Q02574,is information needed on best ways to care for the garden once planted
Q02414,do you want to read articles about the tax rate or know the tax rate percentage
Q03318,would you like to buy the dvd of er tv show
Q01381,are you trying to locate the causes for lipoma
Q00908,are you looking for information on the tv show mister rogers or the movie about him
Q02521,how is a carotid cavernous fistula diagnosed
Q03494,would you like to know how to watch tv on your computer
Q02833,what kind of school subject are you interested in making the halloween activities for
Q01414,are you wanting to know more about the entrance requirements
Q02728,what aspect of the last supper painting are you interested in
Q02555,i can find a lesson plan for a class related to it would you be interested
Q01670,do you need more information about different kinds of air travel
Q02463,do you want to watch funny penguin videos
Q02616,is there any specific music genre you are interested in
Q02865,what problems with the ford edge are you asking about transmission liftgate brakes etc
Q00197,are you interested in finding a local tattoo shop that does flame design
Q02716,what are you using the design for
Q00784,are you looking for companies to build a fence for you
Q00238,are you interested in how pvc is made
Q01374,are you trying to find specific toilet parts
Q01031,are you looking for specific information related to parents of children with ocd
Q00297,are you interested in learning more about ralph owen brewseter
Q00763,are you looking for bedroom furniture
Q03564,would you like to know of any bobcats for sale
Q02242,do you want to know the responsibilities of a paralegal
Q00088,are you interested in a map of the sangre de cristo mountains
Q03587,would you like to know the climate figs are found in
Q02723,what area of your home would you like to organize
Q00116,are you interested in a specific season of inuyasha
Q01083,are you looking for the nearest junck yard
