question_id,question
Q05226,do you want to see a map of the afghanistan country
Q05227,would you want to learn about afghanistan local cuisine
Q05228,would you like to see models of mgb
Q05229,would you like to find mgbs for sale
Q05230,would you like to know about common problems on mgb
Q05231,are you interested in the color of the mgb
Q05232,would you like to know about the limited edition mgb
Q05233,do you want to know about the body design of the mgb
Q05234,are you looking for ways to manage your diabetes
Q05235,would you like to know the symptoms of diabetes
Q05236,are you looking for a diabetes experts
Q05237,which diabetic symptoms are you experiencing
Q05238,are you interested in any of the following treatment options for diabetes
Q05239,are you looking for diabetic certifications or training
Q05240,would you like to know about the types of dinosaurs that existed
Q05241,do you want to know how the dinosaurs went extinct
Q05242,can i tell you about the different periods when dinosaurs lived
Q05243,which dinosaurs would you like to know about
Q05244,would you like more information about dinosaur fossils
Q05245,would you like to know about dinosaur attactions
Q05246,"are you referring to a half, full, or double windsor knot"
Q05247,"do you want to to see instructions with words, pictures, or both"
Q05248,are you interested in watching a video about how to tie a windsor knot
Q05249,would you like to see photos of a windsor knot
Q05250,would you like to see different knots
Q05251,would you like to see step by step instructions
Q05252,would you want to see more of the wall album
Q05253,are you interested in seeing images of the film the wall
Q05254,do you want to know about the nostalgia critic's the wall
Q05255,do you want to see the wall from game of thrones
Q05256,do you want to see the berlin wall
Q05257,are you looking for images of the wall on the border of mexico
Q05258,would you like to see examples of hobby stores
Q05259,would you like to see hobby ideas
Q05260,would you like to see hobby store examples
Q05261,should i pull up a list of  popular hobby stores in the united states
Q05262,do you have a specific hobby category that you want to focus on
Q05263,are you interested in purchasing a hobby store franchise
Q05264,are you wanting to see the graves at the culpeper national cemetery
Q05265,are you looking for memorials and funerals at culpeper national cemetery
Q05266,are you also interested in seeing other national cemeteries
Q05267,would you like to see images of the cemetery
Q05268,would you like to see a map
Q05269,would you like to see some gravestones
Q05270,do you want to see a salry comparison for computer programming
Q05271,are you looking for more information on what computer programming is
Q05272,do you want to see computer programming in action
Q05273,are you interested in computer programming jobs
Q05274,would you like to know of courses that can help you become qualified in computer programming
Q05275,would you like to know the differences between computer programming and computer science
Q05276,would you like to know about a famous wiki
Q05277,would you like to know how to work on a wiki
Q05278,would you like to see examples of wikis
Q05279,are you looking for mother's day songs for kids to sing
Q05280,are you looking for pop songs about mother's day
Q05281,are you interested in mother's day songs for karaoke
Q05282,are you interested in mothers day songs for kids
Q05283,do you want to see list of the top mother's day songs
Q05284,are you interested in mothers day songs for church
Q05285,would you like to know about wall solar water fountains
Q05286,are you interested in solar water fountains for your garden
Q05287,would you like to know about solar water fountain bird baths
Q05288,what do you want the solar water fountain for
Q05289,what artistic style would you like in a fountain
Q05290,what size solar water fountain would you be interested in
Q05291,would you like information about mens or womans volleyball or coaching
Q05292,which alien vs. predator would like to know about
Q05293,are you interested in toys or decals featuring avp
Q05294,are you interested in avp
Q05295,do you want to see avp characters
Q05296,would you like to see scenes from avp
Q05297,are you interested in information regarding dog heat stroke
Q05298,do you want more information regarding the canine heat cycle
Q05299,are you seeking pictures of heat rash on dogs
Q05300,would you like to see females in heat
Q05301,would you like to see a dog's cycle
Q05302,would you like to see dog diapers
Q05303,do you want to images of getting organized at home
Q05304,are you interested in getting organized at work
Q05305,would you like to see more of getting organized for school
Q05306,would you like to see tools to help get organized
Q05307,would you like to see how to get your house organized
Q05308,would you like to see how to get your children organized
Q05309,what material would you like to use for your raised garden
Q05310,what do you want to plant in your raised garden
Q05311,what type of raised garden are you interested in
Q05312,would you like to see pictures of pretty raised gardens
Q05313,are you interested in boxes for a raised garden
Q05314,did you want some raised garden layout ideas
Q05315,what type of sewing machine are you using
Q05316,is there a specific sewing stitch you are looking for
Q05317,what type of material are you trying to sew
Q05318,would you like to read some books that contain sewing instructions
Q05319,would you prefer some sewing instructions videos
Q05320,do you want some sewing instructions in pattern form.
Q05321,would you like to see the map of orcas island
Q05322,are you referring to the buildings in orcas island
Q05323,do you want to see people enjoying themselves on orcas island
Q05324,do you want to see old pictures
Q05325,do you want to see a map
Q05326,do you want to see camping areas
Q05327,"would you like to see depictions of euclid, the ancient greek mathematician"
Q05328,are you interested in euclidean geometry
Q05329,do you want to see a euclidean plane
Q05330,are you interested in euclid's biography
Q05331,do you want to see the elements of euclid
Q05332,do you want to check out the city of euclid in ohio
Q05333,would you be itnerested in these tonics for sore throat
Q05334,are you wanting infographics of homepathic remedies for a sore throat
Q05335,would you also like to see other homeopathic/folk remedies
Q05336,do you want to see what will help
Q05337,do you want to see a sore throat
Q05338,what you should drink for a sore throat
Q05339,are you interested in watching tv shows on a computer
Q05340,do you want to know how to setup a computer with monitor
Q05341,would you like to see people watching shows on computer
Q05342,do you want to know what hulu tv shows you can watch on your computer
Q05343,do you want to browse a selection of netflix tv shows you can watch on your computer
Q05344,would you like to view which amazon prime tv shows you can watch on your computer
Q05345,are you interested in healthy vldl levels
Q05346,are you looking for ways to lower vldl levels
Q05347,are you interested in vldl levels in women
Q05348,do you want to see vldl level graphs
Q05349,are you interested in the numbers of vldl levels
Q05350,do you want to know about vldl levels
Q05351,are you seeking medical images of carotid cavernous fistula treatment
Q05352,did you want to see before an dafter pictures for carotid cavernous fistula treatment
Q05353,would you like more information on carotid cavernous fistula itself
Q05354,do you want to see what it does to your eye
Q05355,do you want to see a graph
Q05356,do you want to see a brain scan
Q05357,what color iron are you looking for
Q05358,would you like a modern iron or a traditonal iron
Q05359,what size iron are you looking for
Q05360,are you talking about iron as a metal
Q05361,are you talking about iron in humans
Q05362,do you want to know about ironman
Q05363,would you like to see pictures of the sherwood regional library grounds
Q05364,did you want to see inside of the sherwood regional library
Q05365,would you be interested in other library photos as well
Q05366,do you want to see a map of the sherwood regional library location
Q05367,are you interested in the services provided by the sherwood regional library
Q05368,do you want to know the hours of sherwood regional library
Q05369,would you like to see photos of the alexian brothers hospital in 1934
Q05370,would you like to take a look at the grounds for present day alexian brothers hospital
Q05371,do you want to view a map of the alexian brothers hospital
Q05372,do you want to see modern images of alexian brothers hospital
Q05373,would you like to see old images of alexian brothers hospital
Q05374,do you want to see artwork of alexian brothers hospital
Q05375,are you wanting to see the anatomy of a sore throat
Q05376,are you wanting to see sore throat lozenges
Q05377,do you want to see strep throat pictures
Q05378,would you like to see what a sore throat looks like
Q05379,would you like to see what medicine to take for a sore throat
Q05380,would you like to see what you can eat if you have a sore throat
Q05381,are you interested in images of satellites in space
Q05382,are you wanting to see the inside of a satellite
Q05383,are you wanting to see satellite dishes
Q05384,would you like to know detail on what the new satellite bluewalker 3 looks like
Q05385,would you like to see satellite imagery of hurricanes (images shot from satellites)
Q05386,would you like imagery about different satellite orbits
Q05387,"do you mean flushing, queens"
Q05388,"do you want to know how to get to flushing, queens"
Q05389,are you referring to flushing a toilet
Q05390,do you want to see examples of flushing
Q05391,"are you interested in flushing, queens"
Q05392,are you interested in seeing images of fire hydrants flushing
Q05393,would you like to see butter and margarine spread
Q05394,do you want to see butter and margarine as sticks
Q05395,are you interested in butter and margarine recipes
Q05396,would you like to see photos of the difference
Q05397,would you like to see photos of different brands of butter
Q05398,would you like to see photos of different brands of margarine
Q05399,are you wanting crockpot recipes for beef stroganoff
Q05400,did you want easy beef stroganoff recipes with cream of mushroom
Q05401,were you interested in russian beef stroganoff
Q05402,would you like to see some beef stroganoff
Q05403,are you interested in beef stroganoff sauce
Q05404,do you want to see beef stroganoff in the pan
Q05405,are you researching cities named bellevue
Q05406,do you want to know about medical institutions named bellevue
Q05407,did you mean to look up religious institutions named bellevue
Q05408,which town of bellevue are you looking for
Q05409,do you want to learn more about bellevue university
Q05410,do you want to know about bellevue wa
Q05411,what does a carpenter bee nest look like
Q05412,what does a carpenter bee sting look like
Q05413,what types of traps are there for carpenter bees
Q05414,did you want to see what a carpenter bee looks like
Q05415,would you like to see how carpenter bees find homes
Q05416,would you like see ways to exterminate carpenter bees
Q05417,did you want to see the exterior of the pacific northwest laboratory
Q05418,did you also want to see inside of the pacific northwest laboratory
Q05419,did you want to see scientists from the pacific northwest laboratory
Q05420,are you interested in learning at pacific northwest laboratory
Q05421,would you like to see a map of the campus
Q05422,would like to know the projects being worked on pacific northwest laboratory
Q05423,would you like to know about the plot of the book
Q05424,would you like to know about the cover art for holes
Q05425,would you like to know about the movie that was made from the book holes
Q05426,would you like places that you can purchase holes by louis sachar
Q05427,would you like to learn more about author louis sachar
Q05428,would you like to see images from the movie holes based on the book holes by louis sachar
Q05429,do you want to know who are the best carriers
Q05430,do you want to consider cost
Q05431,are you considering wheter to get long term care insurance
Q05432,are you looking to see long term insurance costs
Q05433,are you looking for the best long term care insurance companies
Q05434,would you like to see the benefits of long term care insurance
Q05435,do you want to see us coins
Q05436,do you want to see foreign coins
Q05437,would you like to see us silver coins
Q05438,do you want to purchase supplies to store old collector coins
Q05439,do you want to know about valuable old american coins
Q05440,do you want to see some examples of old coins found from antiquity
Q05441,do you want to see hip fracture x-rays
Q05442,are you interested in hip fractures in elderly people
Q05443,would you like to see surgery for hip fractures
Q05444,are interested in the symptoms
Q05445,do you want to see a hip fracture x-ray
Q05446,would you like to know what types of hip fractures there are
Q05447,are you looking for examples of game theory
Q05448,are you interested in books about game theory
Q05449,are you interested in practioners of game theory
Q05450,are you looking for game theory on youtube
Q05451,are you interested in economic game theory
Q05452,would you like to know how game theory relates to war
Q05453,would you like to see a map of the 2008 election
Q05454,do you want to also see other maps of past electoral results
Q05455,would you like more information on the electoral college
Q05456,which state would you like results for
Q05457,would you like to see a national map of the election results for 2008
Q05458,do you want to know about the 2008 candidates
Q05459,are you looking for dark chocolate health benefits research
Q05460,are you interested in dark chocolate health benefits vs regular chocolate
Q05461,are you looking for mental health benefits of dark chocolate
Q05462,do you want to see some benefits
Q05463,do you want to see different brands
Q05464,do you want to see recipes
Q05465,do you want to know about graceland
Q05466,do you want to know about his honeymoon house
Q05467,do you want to see graceland's surroundings
Q05468,"would you like to see images of graceland, elvis presley's home"
Q05469,"would you like to plan a trip to graceland, home of elvis presley"
Q05470,"would you like to learn facts about graceland, home of elivs presley"
Q05471,are you interested in diversity in europe
Q05472,are you interested in diversity training
Q05473,are you interested in diversity in schools
Q05474,would you like me to list the three most diverse states in america
Q05475,care to check out a list of three least diverse states in america
Q05476,"do you want me to tell you which three races/ethnic groups make up the largest percentage of people, in your home state of new york"
Q05477,are you wanting to see the poconos resorts
Q05478,would you like to see images of the poconos mountains wildlife
Q05479,are you looking for things to do in poconos
Q05480,are you interested in knowing about the hotels in the poconos
Q05481,would you like to know about the activities that are available in the poconos in the summer
Q05482,would you like to know about activities that are available in the poconos in the winter
Q05483,do you want to learn some interesting facts about madam c. j. walker
Q05484,do you want to learn about how madam c. j. walker made her fortune
Q05485,are you interested in photos of madam cj walker
Q05486,would you like to know about the self made millionaire
Q05487,"are you wanting information about madam cj walker dolls, books, commemorative items, or something else"
Q05488,would you like to see photos of the syringa
Q05489,would you like to see the idaho state flag
Q05490,do you want to see photos of the idaho state bird
Q05491,would you like to see different pictures of the idaho state flower
Q05492,did you want to know about other states with similar state flowers
Q05493,are you looking for flowers with white petals
Q05494,were you interested in viewing a portrait of ralph owen brewster
Q05495,did you want to see other senators for maine
Q05496,are you wanting to see historical items from ralph owen brewster
Q05497,do you want to see ralph owen brewster
Q05498,would you like to see ralph owen brewster estate
Q05499,are you interested in seeing ralph owen brewster artwork
Q05500,would you like to see album cover art for neil young
Q05501,are you interested in quotes by neil young
Q05502,would like to see what neil young looked like in the 70s
Q05503,would you like to know about neil young music albums
Q05504,are you interested in neil young on spotify
Q05505,are you interested in finding out about artists similar to neil young
Q05506,do you want to know the signs of lymphoma in dogs
Q05507,are you interested in toungue lymphoma
Q05508,do you want to know when to put down a dog with lymphoma
Q05509,are you interested in infographics regarding lymphoma in dogs
Q05510,are you wanting to see photos of cutaneous lymphoma in dogs
Q05511,were you looking for photos of t-cell lymphoma in dogs
Q05512,are you interested in early warning signs of a heartattack
Q05513,are you looking for signs of a heart attack in women
Q05514,are you interested in signs of a heart attack compared to a stroke
Q05515,would you like to know how signs of a heartattack differ between men and women
Q05516,would you like to know the early signs of a heartattack
Q05517,would you like to know what happens during a heartattack
Q05518,are you looking for milwaukee journal sentinel reporters
Q05519,are you interested in milwaukee journal sentinel breaking news stories
Q05520,do you want to see the milwaukee journal sentinel building
Q05521,which journal sentinel are you referring to
Q05522,are you interested in seeing articles from the milwaukee journal sentinel
Q05523,are you interested to see website design hosting packages
Q05524,would you like to know what are the best website design and hosting companies
Q05525,were you looking for website design hosting packages
Q05526,are you searching for website design hosting that is free
Q05527,are you looking for templates of website design hosting
Q05528,are you looking for things to do in porterville
Q05529,are you interested in the history of porterville
Q05530,are you looking for places to stay in porterville
Q05531,"do you want to see porterville, california"
Q05532,"do you want to see porterville, south africa"
Q05533,would you like to see porterville churches
Q05534,would you like to see images of classes with the arkadelphia health club
Q05535,would you like to view images of the inside of the arkadelphia health club
Q05536,are you interested in what is offered at the arkadelphia health club
Q05537,do you want to know more about arkadelphia health club
Q05538,are you interested in the sports arkadelphia health club offers
Q05539,would you like to see people exercising at arkadelphia health club
Q05540,did you mean the seven deadly sins in shazam
Q05541,were you referring to the seven deadly sins found in the bible
Q05542,were you interested in the seven deadly sins in fullmetal alchemist perhaps
Q05543,did you want to see infor on the seven deadly sins from the bible
Q05544,ddi you also want to know the seven holy virtues
Q05545,were you interested in the seven deadly sins series
Q05546,would you like to see rocks and gems
Q05547,are you interested in purple rocks and gems
Q05548,does a rock and gem show interest you
Q05549,would you like to see examples of rocks and gems
Q05550,would you like to see an onyx gemstone
Q05551,would you like to see different types of rocks
Q05552,are you looking for a gs pay rate calculator
Q05553,are you interested in the gs pay rate for dc
Q05554,are you looking for the gs pay rate changes over time
Q05555,do you want to know to whom the pay rate applies
Q05556,would you like to see a chart of the pay rate
Q05557,do you want to know who administers the general schedule pay rate
Q05558,would you like a list of atari games
Q05559,"would you like to know about the atari flashback, the world's smallest atari, the computer video game console, or some other atari"
Q05560,would you like the history of the atari video game franchise
Q05561,would you like to see atari games
Q05562,would you like to see atari consoles
Q05563,would you like to see atari parts
Q05564,are you asking how to dispose of lead acid batteries
Q05565,are you inquiring as to what happens to lead acid batteries when they are recycled
Q05566,are you looking into reusing lead acid batteries
Q05567,are you interested in regulations for recycling lead acid batteries
Q05568,are you interested in recycling lead acid batteries facilities
Q05569,are you looking for recyling lead acid batteries for money
Q05570,what color flame design are you looking for
Q05571,are you looking for flame tattoos
Q05572,are you looking for flame designs on cars
Q05573,are you browsing for flame designs in sticker form
Q05574,would you like to get a flame design tattoo
Q05575,do you want to see nail art with flame designs
Q05576,did you want actual images of civil war battles in south carolina
Q05577,were you wanting a map of civil war battle locations in south carolina
Q05578,were you interested in other civil war battle sites as well
Q05579,would you like to see pictures of south carolina during the civil war
Q05580,would you like to see soldiers from the civil war
Q05581,would you like to see a map
Q05582,do you want to see a map
Q05583,do you want to see their logo
Q05584,do you want to see graduation pictures
Q05585,are you interested in obtaining an associate's degree from the university of phoenix
Q05586,do you want to see what bachelor's degrees are available from the university of phoenix
Q05587,are you looking to pursue a master's degree from the university of phoenix
Q05588,would you like to see the family tree with pictures or text
Q05589,would you like to see pictures of obama with his family in kenya
Q05590,are you interested in other presidential family trees as well
Q05591,are you interested in president obama's family posed near trees
Q05592,are you looking for information about the obamas and the national christmas tree
Q05593,is the ancestral heritage of president obama what you are concerned with
Q05594,did you want to see real estate appraisal forms
Q05595,were you interested in infographics about home appraisals
Q05596,did you want to see other types of appraisal information
Q05597,did you want information about the techniques used in painting the last supper
Q05598,did you want information about the painter of the last supper
Q05599,are you interested in the location of the last supper
Q05600,would you like to see photos of the painting
Q05601,would you like to see the painting in a museum
Q05602,would you like to see photos of the artists
Q05603,would you like an infographic on barrett's esophagus
Q05604,would you like to view images of what barret's esophagus looks like from the inside
Q05605,would you like to know more about what foods to eat and to avoid with barrett's esophagus
Q05606,do you want to know what games are available from espn sports on the wii platform
Q05607,do you want to see pictures of espn world of sports in florida
Q05608,do you want to see the sportscasters that are on espn sports
Q05609,which espn news shows do you watch
Q05610,are you interested in the espn monday night football annoucers
Q05611,which espn personalities are you interested in learning about
Q05612,would you like to find out which doctors treats carpal tunnel syndrome
Q05613,would you like information about carpal tunnel treatments
Q05614,did you want more information regarding carpal tunnel syndrome symptoms
Q05615,were you interested in treatment for carpal tunnel syndrome
Q05616,would you like to view exercises for carpal tunnel syndrome
Q05617,would you like to images of ron howard
Q05618,are you interested in director ron howard
Q05619,do you want a list of roles ron howard has played
Q05620,did you want to see pictures of ron howard in his acting roles
Q05621,would you like to know which movies ron howard has directed
Q05622,are you interested in ron howard's famous family members
Q05623,are you looking for weatherstripping on doors
Q05624,do you want information on weatherstripping
Q05625,would you like to know other ways to winterize your home
Q05626,are you interested in weather stripping for your home or car
Q05627,what type of weather stripping are you referring to
Q05628,would like to know how to install weather stripping
Q05629,are you interested in templates for wedding expenses
Q05630,do you want to see wedding budge calculators
Q05631,are you referring to a physical calculator
Q05632,are you interested in business phone services
Q05633,do you need a voip phone service
Q05634,do you need a whole system of internet phones
Q05635,are you searching fo rinternet phone service providers
Q05636,would you like infographics regarding voip
Q05637,were you wanting to see a voip box
Q05638,would you like to see the the cheapest internet providers
Q05639,would you like a home package deals
Q05640,are you looking for cheap ways to purchase internet traffic
Q05641,are you interested in cheap internet
Q05642,would you like news on cheap internet
Q05643,do you want to see deals on cheap internet
Q05644,are you interested in the steps of dmv registeration in va
